text,clean,casefolding,tokenize,stopwords,stemming
b'@tubirfess Tapi selain dr alamat paket data manusia di indonesia sudah bocor juga \xf0\x9f\x98\xad', Tapi selain dr alamat paket data manusia di indonesia sudah bocor juga , tapi selain dr alamat paket data manusia di indonesia sudah bocor juga ,"['tapi', 'selain', 'dr', 'alamat', 'paket', 'data', 'manusia', 'di', 'indonesia', 'sudah', 'bocor', 'juga']","['dr', 'alamat', 'paket', 'data', 'manusia', 'indonesia', 'bocor']",dr alamat paket data manusia indonesia bocor
b'@tubirfess Data bocor itumah', Data bocor itumah, data bocor itumah,"['data', 'bocor', 'itumah']","['data', 'bocor', 'itumah']",data bocor itumah
"b'Kayaknya ini data bocor, soalnya kena yg emang sering belanja cod https://t.co/hy18TUYvM4'",Kayaknya ini data bocor soalnya kena yg emang sering belanja cod ,kayaknya ini data bocor soalnya kena yg emang sering belanja cod ,"['kayaknya', 'ini', 'data', 'bocor', 'soalnya', 'kena', 'yg', 'emang', 'sering', 'belanja', 'cod']","['kayaknya', 'data', 'bocor', 'kena', 'yg', 'emang', 'belanja', 'cod']",kayak data bocor kena yg emang belanja cod
"b'@tubirfess Eh ini ada yg pernah bikin threadnya, udah sindikat ini dan di thread bilang kalau kemungkinan besar data bocor dibandingin sama kemungkinan orang ngais2 sampah buat liat alamat.'", Eh ini ada yg pernah bikin threadnya udah sindikat ini dan di thread bilang kalau kemungkinan besar data bocor dibandingin sama kemungkinan orangsampah buat liat alamat, eh ini ada yg pernah bikin threadnya udah sindikat ini dan di thread bilang kalau kemungkinan besar data bocor dibandingin sama kemungkinan orangsampah buat liat alamat,"['eh', 'ini', 'ada', 'yg', 'pernah', 'bikin', 'threadnya', 'udah', 'sindikat', 'ini', 'dan', 'di', 'thread', 'bilang', 'kalau', 'kemungkinan', 'besar', 'data', 'bocor', 'dibandingin', 'sama', 'kemungkinan', 'orangsampah', 'buat', 'liat', 'alamat']","['eh', 'yg', 'bikin', 'threadnya', 'udah', 'sindikat', 'thread', 'bilang', 'data', 'bocor', 'dibandingin', 'orangsampah', 'liat', 'alamat']",eh yg bikin threadnya udah sindikat thread bilang data bocor dibandingin orangsampah liat alamat
b'Gila nih hackers dari Amerika latin basis data (database) Polri bocor ke publik haha \xf0\x9f\x98\x82 https://t.co/C7xlMt3kx1',Gila nih hackers dari Amerika latin basis data database Polri bocor ke publik haha,gila nih hackers dari amerika latin basis data database polri bocor ke publik haha,"['gila', 'nih', 'hackers', 'dari', 'amerika', 'latin', 'basis', 'data', 'database', 'polri', 'bocor', 'ke', 'publik', 'haha']","['gila', 'nih', 'hackers', 'amerika', 'latin', 'basis', 'data', 'database', 'polri', 'bocor', 'publik', 'haha']",gila nih hackers amerika latin basis data database polri bocor publik haha
b'@Avatar_Rokupang @KediriFess bisa taunya kalo data bocor itu gimana?',bisa taunya kalo data bocor itu gimana,bisa taunya kalo data bocor itu gimana,"['bisa', 'taunya', 'kalo', 'data', 'bocor', 'itu', 'gimana']","['taunya', 'kalo', 'data', 'bocor', 'gimana']",tau kalo data bocor gimana
b'@redandviollet tapi kan itu minnie kasih waktu nya kali makanya vlive nya yg tadi di hapus takut data bocor \xf0\x9f\x98\x82', tapi kan itu minnie kasih waktu nya kali makanya vlive nya yg tadi di hapus takut data bocor , tapi kan itu minnie kasih waktu nya kali makanya vlive nya yg tadi di hapus takut data bocor ,"['tapi', 'kan', 'itu', 'minnie', 'kasih', 'waktu', 'nya', 'kali', 'makanya', 'vlive', 'nya', 'yg', 'tadi', 'di', 'hapus', 'takut', 'data', 'bocor']","['minnie', 'kasih', 'nya', 'kali', 'vlive', 'nya', 'yg', 'hapus', 'takut', 'data', 'bocor']",minnie kasih nya kali vlive nya yg hapus takut data bocor
b'@CNNIndonesia Data penduduk aja masih banyak yg bocor....', Data penduduk aja masih banyak yg bocor, data penduduk aja masih banyak yg bocor,"['data', 'penduduk', 'aja', 'masih', 'banyak', 'yg', 'bocor']","['data', 'penduduk', 'aja', 'yg', 'bocor']",data duduk aja yg bocor
"b'Hallo @BANKBRI_ID tolong tindaklanjutnya, kenapa data nasabah kartu kredit bri bisa bocor ke CHUBB-life insurance tolong tanggung jawab...'",Hallotolong tindaklanjutnya kenapa data nasabah kartu kredit bri bisa bocor ke CHUBBlife insurance tolong tanggung jawab,hallotolong tindaklanjutnya kenapa data nasabah kartu kredit bri bisa bocor ke chubblife insurance tolong tanggung jawab,"['hallotolong', 'tindaklanjutnya', 'kenapa', 'data', 'nasabah', 'kartu', 'kredit', 'bri', 'bisa', 'bocor', 'ke', 'chubblife', 'insurance', 'tolong', 'tanggung', 'jawab']","['hallotolong', 'tindaklanjutnya', 'data', 'nasabah', 'kartu', 'kredit', 'bri', 'bocor', 'chubblife', 'insurance', 'tolong', 'tanggung']",hallotolong tindaklanjutnya data nasabah kartu kredit bri bocor chubblife insurance tolong tanggung
"b'Mau verifikasi data tokped aja nggak bisa dikasih watermark dulu KTPnya. Selama belum ada perlindungan data konsumen kalau data bocor di Indonesia, jujur saya was-was ya. Mungkin bisa dikasih opsi biar bisa upload KTP via gallery (tidak direct langsung dari kamera) @TokopediaCare'",Mau verifikasi data tokped aja nggak bisa dikasih watermark dulu KTPnya Selama belum ada perlindungan data konsumen kalau data bocor di Indonesia jujur saya waswas ya Mungkin bisa dikasih opsi biar bisa upload KTP via gallery tidak direct langsung dari kamera ,mau verifikasi data tokped aja nggak bisa dikasih watermark dulu ktpnya selama belum ada perlindungan data konsumen kalau data bocor di indonesia jujur saya waswas ya mungkin bisa dikasih opsi biar bisa upload ktp via gallery tidak direct langsung dari kamera ,"['mau', 'verifikasi', 'data', 'tokped', 'aja', 'nggak', 'bisa', 'dikasih', 'watermark', 'dulu', 'ktpnya', 'selama', 'belum', 'ada', 'perlindungan', 'data', 'konsumen', 'kalau', 'data', 'bocor', 'di', 'indonesia', 'jujur', 'saya', 'waswas', 'ya', 'mungkin', 'bisa', 'dikasih', 'opsi', 'biar', 'bisa', 'upload', 'ktp', 'via', 'gallery', 'tidak', 'direct', 'langsung', 'dari', 'kamera']","['verifikasi', 'data', 'tokped', 'aja', 'nggak', 'dikasih', 'watermark', 'ktpnya', 'perlindungan', 'data', 'konsumen', 'data', 'bocor', 'indonesia', 'jujur', 'waswas', 'ya', 'dikasih', 'opsi', 'biar', 'upload', 'ktp', 'via', 'gallery', 'direct', 'langsung', 'kamera']",verifikasi data tokped aja nggak kasih watermark ktpnya lindung data konsumen data bocor indonesia jujur waswas ya kasih opsi biar upload ktp via gallery direct langsung kamera
"b'Tiap hari ditelponin sales kartu kredit, sales rumah, sales mobil \n\nIni data apa bocor apa gimana? \xf0\x9f\x98\x91'",Tiap hari ditelponin sales kartu kredit sales rumah sales mobil nnIni data apa bocor apa gimana ,tiap hari ditelponin sales kartu kredit sales rumah sales mobil nnini data apa bocor apa gimana ,"['tiap', 'hari', 'ditelponin', 'sales', 'kartu', 'kredit', 'sales', 'rumah', 'sales', 'mobil', 'nnini', 'data', 'apa', 'bocor', 'apa', 'gimana']","['ditelponin', 'sales', 'kartu', 'kredit', 'sales', 'rumah', 'sales', 'mobil', 'nnini', 'data', 'bocor', 'gimana']",ditelponin sales kartu kredit sales rumah sales mobil nnini data bocor gimana
"b'@zarazettirazr Bocar bocor aja kayak ember, apa sih data yg gak bisa bocor di Indonesia?. Edisi Ruwetnesia !!'", Bocar bocor aja kayak ember apa sih data yg gak bisa bocor di Indonesia Edisi Ruwetnesia , bocar bocor aja kayak ember apa sih data yg gak bisa bocor di indonesia edisi ruwetnesia ,"['bocar', 'bocor', 'aja', 'kayak', 'ember', 'apa', 'sih', 'data', 'yg', 'gak', 'bisa', 'bocor', 'di', 'indonesia', 'edisi', 'ruwetnesia']","['bocar', 'bocor', 'aja', 'kayak', 'ember', 'sih', 'data', 'yg', 'gak', 'bocor', 'indonesia', 'edisi', 'ruwetnesia']",bocar bocor aja kayak ember sih data yg gak bocor indonesia edisi ruwetnesia
b'@zwolftenaugust Coba scroll ke bawah. Biasanya ditulis breachnua darimana. Gw dari tokped yg kasus data bocor itu wkwk', Coba scroll ke bawah Biasanya ditulis breachnua darimana Gw dari tokped yg kasus data bocor itu wkwk, coba scroll ke bawah biasanya ditulis breachnua darimana gw dari tokped yg kasus data bocor itu wkwk,"['coba', 'scroll', 'ke', 'bawah', 'biasanya', 'ditulis', 'breachnua', 'darimana', 'gw', 'dari', 'tokped', 'yg', 'kasus', 'data', 'bocor', 'itu', 'wkwk']","['coba', 'scroll', 'ditulis', 'breachnua', 'darimana', 'gw', 'tokped', 'yg', 'data', 'bocor', 'wkwk']",coba scroll tulis breachnua darimana gw tokped yg data bocor wkwk
b'@mempersulit wkwkwkw berarti bocor ya data ne', wkwkwkw berarti bocor ya data ne, wkwkwkw berarti bocor ya data ne,"['wkwkwkw', 'berarti', 'bocor', 'ya', 'data', 'ne']","['wkwkwkw', 'bocor', 'ya', 'data', 'ne']",wkwkwkw bocor ya data ne
"b'Min @HaloBCA Tadi ada yg call saya nawarin kta dari dbs, trus bilang dpt no saya dari pt aki dimana no saya d dpt dari pembukaan rekening bank. Saya cm punya satu akun rekening dan itu d bca. Gmana data nomor hp kok bisa bocor ke pihak lain https://t.co/dVi4AK3V8a'",MinTadi ada yg call saya nawarin kta dari dbs trus bilang dpt no saya dari pt aki dimana no saya d dpt dari pembukaan rekening bank Saya cm punya satu akun rekening dan itu d bca Gmana data nomor hp kok bisa bocor ke pihak lain ,mintadi ada yg call saya nawarin kta dari dbs trus bilang dpt no saya dari pt aki dimana no saya d dpt dari pembukaan rekening bank saya cm punya satu akun rekening dan itu d bca gmana data nomor hp kok bisa bocor ke pihak lain ,"['mintadi', 'ada', 'yg', 'call', 'saya', 'nawarin', 'kta', 'dari', 'dbs', 'trus', 'bilang', 'dpt', 'no', 'saya', 'dari', 'pt', 'aki', 'dimana', 'no', 'saya', 'd', 'dpt', 'dari', 'pembukaan', 'rekening', 'bank', 'saya', 'cm', 'punya', 'satu', 'akun', 'rekening', 'dan', 'itu', 'd', 'bca', 'gmana', 'data', 'nomor', 'hp', 'kok', 'bisa', 'bocor', 'ke', 'pihak', 'lain']","['mintadi', 'yg', 'call', 'nawarin', 'kta', 'dbs', 'trus', 'bilang', 'dpt', 'no', 'pt', 'aki', 'dimana', 'no', 'd', 'dpt', 'pembukaan', 'rekening', 'bank', 'cm', 'akun', 'rekening', 'd', 'bca', 'gmana', 'data', 'nomor', 'hp', 'bocor']",mintadi yg call nawarin kta dbs trus bilang dpt no pt aki mana no d dpt buka rekening bank cm akun rekening d bca gmana data nomor hp bocor
"b""Kamu gak perlu khawatir data akan 'bocor', karena kerahasiaan dan keamanan informasi kamu adalah prioritas kami. Semua informasi yang kamu berikan tidak akan dibuka tanpa persetujuanmu.\n\xc2\xa0\nKerahasiaan informasi kamu dijamin oleh undang-undang.\n\xc2\xa0\n#updatestatus #BERANIUpdateStatus https://t.co/goCwttHtDq""",Kamu gak perlu khawatir data akan bocor karena kerahasiaan dan keamanan informasi kamu adalah prioritas kami Semua informasi yang kamu berikan tidak akan dibuka tanpainformasi kamu dijamin oleh ,kamu gak perlu khawatir data akan bocor karena kerahasiaan dan keamanan informasi kamu adalah prioritas kami semua informasi yang kamu berikan tidak akan dibuka tanpainformasi kamu dijamin oleh ,"['kamu', 'gak', 'perlu', 'khawatir', 'data', 'akan', 'bocor', 'karena', 'kerahasiaan', 'dan', 'keamanan', 'informasi', 'kamu', 'adalah', 'prioritas', 'kami', 'semua', 'informasi', 'yang', 'kamu', 'berikan', 'tidak', 'akan', 'dibuka', 'tanpainformasi', 'kamu', 'dijamin', 'oleh']","['gak', 'khawatir', 'data', 'bocor', 'kerahasiaan', 'keamanan', 'informasi', 'prioritas', 'informasi', 'dibuka', 'tanpainformasi', 'dijamin']",gak khawatir data bocor rahasia aman informasi prioritas informasi buka tanpainformasi jamin
"b'@Dyanasthasia You should fear now; data NIK Presiden Jokowi sudah ketahuan oleh publik, jual beli data kependudukan Indonesia bocor lewat aplikasi ini dan tiga bulan lalu sudah ada sekitar enam orang di Twitter yang lapor ATMnya dibobol oleh hacker dari negara lain.'", You should fear now data NIK Presiden Jokowi sudah ketahuan oleh publik jual beli data kependudukan Indonesia bocor lewat aplikasi ini dan tiga bulan lalu sudah ada sekitar enam orang di Twitter yang lapor ATMnya dibobol oleh hacker dari negara lain, you should fear now data nik presiden jokowi sudah ketahuan oleh publik jual beli data kependudukan indonesia bocor lewat aplikasi ini dan tiga bulan lalu sudah ada sekitar enam orang di twitter yang lapor atmnya dibobol oleh hacker dari negara lain,"['you', 'should', 'fear', 'now', 'data', 'nik', 'presiden', 'jokowi', 'sudah', 'ketahuan', 'oleh', 'publik', 'jual', 'beli', 'data', 'kependudukan', 'indonesia', 'bocor', 'lewat', 'aplikasi', 'ini', 'dan', 'tiga', 'bulan', 'lalu', 'sudah', 'ada', 'sekitar', 'enam', 'orang', 'di', 'twitter', 'yang', 'lapor', 'atmnya', 'dibobol', 'oleh', 'hacker', 'dari', 'negara', 'lain']","['you', 'should', 'fear', 'now', 'data', 'nik', 'presiden', 'jokowi', 'ketahuan', 'publik', 'jual', 'beli', 'data', 'kependudukan', 'indonesia', 'bocor', 'aplikasi', 'enam', 'orang', 'twitter', 'lapor', 'atmnya', 'dibobol', 'hacker', 'negara']",you should fear now data nik presiden jokowi tahu publik jual beli data duduk indonesia bocor aplikasi enam orang twitter lapor atmnya bobol hacker negara
"b'@jeniushelp Ga membagikan data min. Tapi data saya emang bocor sebelumnya makanya ditelepon dan meyakinkan sekali modusnya.\n\nIni ga perlu jenius untuk memahami, asalkan jujur'", Ga membagikan data min Tapi data saya emang bocor sebelumnya makanya ditelepon dan meyakinkan sekali modusnyannIni ga perlu jenius untuk memahami asalkan jujur, ga membagikan data min tapi data saya emang bocor sebelumnya makanya ditelepon dan meyakinkan sekali modusnyannini ga perlu jenius untuk memahami asalkan jujur,"['ga', 'membagikan', 'data', 'min', 'tapi', 'data', 'saya', 'emang', 'bocor', 'sebelumnya', 'makanya', 'ditelepon', 'dan', 'meyakinkan', 'sekali', 'modusnyannini', 'ga', 'perlu', 'jenius', 'untuk', 'memahami', 'asalkan', 'jujur']","['ga', 'membagikan', 'data', 'min', 'data', 'emang', 'bocor', 'ditelepon', 'modusnyannini', 'ga', 'jenius', 'memahami', 'jujur']",ga bagi data min data emang bocor telepon modusnyannini ga jenius paham jujur
b'@jeniushelp Data tapi udah bocor halus sejak 2020 min', Data tapi udah bocor halus sejakmin, data tapi udah bocor halus sejakmin,"['data', 'tapi', 'udah', 'bocor', 'halus', 'sejakmin']","['data', 'udah', 'bocor', 'halus', 'sejakmin']",data udah bocor halus sejakmin
"b'@jeniushelp @hsn19 Kenapa ga langsung jawab aja kalo emang ada solusinya min?\n\nBank ga perlu lah segitu takutnya ketahuan data bocor, kan brand jenius itu jujur ... harusnya'",Kenapa ga langsung jawab aja kalo emang ada solusinya minnnBank ga perlu lah segitu takutnya ketahuan data bocor kan brand jenius itu jujurharusnya,kenapa ga langsung jawab aja kalo emang ada solusinya minnnbank ga perlu lah segitu takutnya ketahuan data bocor kan brand jenius itu jujurharusnya,"['kenapa', 'ga', 'langsung', 'jawab', 'aja', 'kalo', 'emang', 'ada', 'solusinya', 'minnnbank', 'ga', 'perlu', 'lah', 'segitu', 'takutnya', 'ketahuan', 'data', 'bocor', 'kan', 'brand', 'jenius', 'itu', 'jujurharusnya']","['ga', 'langsung', 'aja', 'kalo', 'emang', 'solusinya', 'minnnbank', 'ga', 'segitu', 'takutnya', 'ketahuan', 'data', 'bocor', 'brand', 'jenius', 'jujurharusnya']",ga langsung aja kalo emang solusi minnnbank ga segitu takut tahu data bocor brand jenius jujurharusnya
"b'Ketika kasus lama ditangani, misalnya, data bocor di sosial media, kampus akan sibuk memadamkan kebakaran dan bisa lupa pada kasus yang harus ditangani. Karena itu, penting mempunyai sistem aduan KS yang cepat, sensitif, dan berpihak pada korban di Perguruan Tinggi.'",Ketika kasus lama ditangani misalnya data bocor di sosial media kampus akan sibuk memadamkan kebakaran dan bisa lupa pada kasus yang harus ditangani Karena itu penting mempunyai sistem aduan KS yang cepat sensitif dan berpihak pada korban di Perguruan Tinggi,ketika kasus lama ditangani misalnya data bocor di sosial media kampus akan sibuk memadamkan kebakaran dan bisa lupa pada kasus yang harus ditangani karena itu penting mempunyai sistem aduan ks yang cepat sensitif dan berpihak pada korban di perguruan tinggi,"['ketika', 'kasus', 'lama', 'ditangani', 'misalnya', 'data', 'bocor', 'di', 'sosial', 'media', 'kampus', 'akan', 'sibuk', 'memadamkan', 'kebakaran', 'dan', 'bisa', 'lupa', 'pada', 'kasus', 'yang', 'harus', 'ditangani', 'karena', 'itu', 'penting', 'mempunyai', 'sistem', 'aduan', 'ks', 'yang', 'cepat', 'sensitif', 'dan', 'berpihak', 'pada', 'korban', 'di', 'perguruan', 'tinggi']","['ditangani', 'data', 'bocor', 'sosial', 'media', 'kampus', 'sibuk', 'memadamkan', 'kebakaran', 'lupa', 'ditangani', 'sistem', 'aduan', 'ks', 'cepat', 'sensitif', 'berpihak', 'korban', 'perguruan']",tangan data bocor sosial media kampus sibuk madam bakar lupa tangan sistem adu ks cepat sensitif pihak korban guru
b'@dowoonverse WKWKWKKWKW ALL HAIL AKUN PRIV \xf0\x9f\x98\x97\xf0\x9f\x98\x97\xf0\x9f\x98\x97\n\nLebih panik kalo akun priv ke publish dibanding data bocor /j', WKWKWKKWKW ALL HAIL AKUN PRIVpanik kalo akun priv ke publish dibanding data bocor j, wkwkwkkwkw all hail akun privpanik kalo akun priv ke publish dibanding data bocor j,"['wkwkwkkwkw', 'all', 'hail', 'akun', 'privpanik', 'kalo', 'akun', 'priv', 'ke', 'publish', 'dibanding', 'data', 'bocor', 'j']","['wkwkwkkwkw', 'all', 'hail', 'akun', 'privpanik', 'kalo', 'akun', 'priv', 'publish', 'dibanding', 'data', 'bocor', 'j']",wkwkwkkwkw all hail akun privpanik kalo akun priv publish banding data bocor j
b'Kamu gak perlu takut nomor pin atau data lain bocor kalau pakai kartu debit BCA chip #ChipLebihSip',Kamu gak perlu takut nomor pin atau data lain bocor kalau pakai kartu debit BCA chip,kamu gak perlu takut nomor pin atau data lain bocor kalau pakai kartu debit bca chip,"['kamu', 'gak', 'perlu', 'takut', 'nomor', 'pin', 'atau', 'data', 'lain', 'bocor', 'kalau', 'pakai', 'kartu', 'debit', 'bca', 'chip']","['gak', 'takut', 'nomor', 'pin', 'data', 'bocor', 'pakai', 'kartu', 'debit', 'bca', 'chip']",gak takut nomor pin data bocor pakai kartu debit bca chip
"b'Apalagi bisa dengan mengganti ke kartu debit ber Chip, kita bisa menggunakan layanan debit online dengan aman nggak takut data kita bocor #ChipLebihSip'",Apalagi bisa dengan mengganti ke kartu debit ber Chip kita bisa menggunakan layanan debit online dengan aman nggak takut data kita bocor,apalagi bisa dengan mengganti ke kartu debit ber chip kita bisa menggunakan layanan debit online dengan aman nggak takut data kita bocor,"['apalagi', 'bisa', 'dengan', 'mengganti', 'ke', 'kartu', 'debit', 'ber', 'chip', 'kita', 'bisa', 'menggunakan', 'layanan', 'debit', 'online', 'dengan', 'aman', 'nggak', 'takut', 'data', 'kita', 'bocor']","['mengganti', 'kartu', 'debit', 'ber', 'chip', 'layanan', 'debit', 'online', 'aman', 'nggak', 'takut', 'data', 'bocor']",ganti kartu debit ber chip layan debit online aman nggak takut data bocor
b'@ysxhhh Di oren ada tapi takut data bocor', Di oren ada tapi takut data bocor, di oren ada tapi takut data bocor,"['di', 'oren', 'ada', 'tapi', 'takut', 'data', 'bocor']","['oren', 'takut', 'data', 'bocor']",oren takut data bocor
b'Hampir setiap hari jg brute forcenya. Entah kenapa gw menuduh tokped karna sempet bocor data pelanggan (meskipun udah sempet gw ganti password)',Hampir setiap hari jg brute forcenya Entah kenapa gw menuduh tokped karna sempet bocor data pelanggan meskipun udah sempet gw ganti password,hampir setiap hari jg brute forcenya entah kenapa gw menuduh tokped karna sempet bocor data pelanggan meskipun udah sempet gw ganti password,"['hampir', 'setiap', 'hari', 'jg', 'brute', 'forcenya', 'entah', 'kenapa', 'gw', 'menuduh', 'tokped', 'karna', 'sempet', 'bocor', 'data', 'pelanggan', 'meskipun', 'udah', 'sempet', 'gw', 'ganti', 'password']","['jg', 'brute', 'forcenya', 'gw', 'menuduh', 'tokped', 'karna', 'sempet', 'bocor', 'data', 'pelanggan', 'udah', 'sempet', 'gw', 'ganti', 'password']",jg brute forcenya gw tuduh tokped karna sempet bocor data langgan udah sempet gw ganti password
"b'Dari sekian banyak kasus kebocoran data di Indonesia, siapa yang sudah mempertanggungjawabkannya? Kepada publik, pengguna yang datanya telanjur bocor?'",Dari sekian banyak kasus kebocoran data di Indonesia siapa yang sudah mempertanggungjawabkannya Kepada publik pengguna yang datanya telanjur bocor,dari sekian banyak kasus kebocoran data di indonesia siapa yang sudah mempertanggungjawabkannya kepada publik pengguna yang datanya telanjur bocor,"['dari', 'sekian', 'banyak', 'kasus', 'kebocoran', 'data', 'di', 'indonesia', 'siapa', 'yang', 'sudah', 'mempertanggungjawabkannya', 'kepada', 'publik', 'pengguna', 'yang', 'datanya', 'telanjur', 'bocor']","['sekian', 'kebocoran', 'data', 'indonesia', 'mempertanggungjawabkannya', 'publik', 'pengguna', 'datanya', 'telanjur', 'bocor']",sekian bocor data indonesia mempertanggungjawabkannya publik guna data telanjur bocor
b'@QUANXlE \xf0\x9f\x98\xad\xf0\x9f\x98\xad\xf0\x9f\x98\xad\xf0\x9f\x98\xad mending kita jd juniornya nikmir ntar dipanggil pas ada data negara bocor',mending kita jd juniornya nikmir ntar dipanggil pas ada data negara bocor,mending kita jd juniornya nikmir ntar dipanggil pas ada data negara bocor,"['mending', 'kita', 'jd', 'juniornya', 'nikmir', 'ntar', 'dipanggil', 'pas', 'ada', 'data', 'negara', 'bocor']","['mending', 'jd', 'juniornya', 'nikmir', 'ntar', 'dipanggil', 'pas', 'data', 'negara', 'bocor']",mending jd junior nikmir ntar panggil pas data negara bocor
b'Contoh liputan kasus kebocoran data pribadi di Indonesia:\n\nData Pribadi yang Bocor Diduga Kuat Identik dengan Data BPJS Kesehatan https://t.co/JvkzTqQLJ3',Contoh liputan kasus kebocoran data pribadi di IndonesiannData Pribadi yang Bocor Diduga Kuat Identik dengan Data BPJS Kesehatan ,contoh liputan kasus kebocoran data pribadi di indonesianndata pribadi yang bocor diduga kuat identik dengan data bpjs kesehatan ,"['contoh', 'liputan', 'kasus', 'kebocoran', 'data', 'pribadi', 'di', 'indonesianndata', 'pribadi', 'yang', 'bocor', 'diduga', 'kuat', 'identik', 'dengan', 'data', 'bpjs', 'kesehatan']","['contoh', 'liputan', 'kebocoran', 'data', 'pribadi', 'indonesianndata', 'pribadi', 'bocor', 'diduga', 'kuat', 'identik', 'data', 'bpjs', 'kesehatan']",contoh liput bocor data pribadi indonesianndata pribadi bocor duga kuat identik data bpjs sehat
b'@bonngbudi Saya sering dpt penipuan gini om...\nKok bisa ya data kita bocor gini...heran', Saya sering dpt penipuan gini omnKok bisa ya data kita bocor giniheran, saya sering dpt penipuan gini omnkok bisa ya data kita bocor giniheran,"['saya', 'sering', 'dpt', 'penipuan', 'gini', 'omnkok', 'bisa', 'ya', 'data', 'kita', 'bocor', 'giniheran']","['dpt', 'penipuan', 'gini', 'omnkok', 'ya', 'data', 'bocor', 'giniheran']",dpt tipu gin omnkok ya data bocor giniheran
"b'Kalau data di sebuah platform bocor, pengelola wajib memberitahukan ke pengguna secara cepat dan detail. \n\nJangan nunggu viral baru komentar... https://t.co/e7709eN9uJ'",Kalau data di sebuah platform bocor pengelola wajib memberitahukan ke pengguna secara cepat dan detail nnJangan nunggu viral baru komentar ,kalau data di sebuah platform bocor pengelola wajib memberitahukan ke pengguna secara cepat dan detail nnjangan nunggu viral baru komentar ,"['kalau', 'data', 'di', 'sebuah', 'platform', 'bocor', 'pengelola', 'wajib', 'memberitahukan', 'ke', 'pengguna', 'secara', 'cepat', 'dan', 'detail', 'nnjangan', 'nunggu', 'viral', 'baru', 'komentar']","['data', 'platform', 'bocor', 'pengelola', 'wajib', 'memberitahukan', 'pengguna', 'cepat', 'detail', 'nnjangan', 'nunggu', 'viral', 'komentar']",data platform bocor kelola wajib memberitahukan guna cepat detail nnjangan nunggu viral komentar
"b'Pernah make canva nggak, tapi data bocor dari situ https://t.co/St25dx4vVv'",Pernah make canva nggak tapi data bocor dari situ ,pernah make canva nggak tapi data bocor dari situ ,"['pernah', 'make', 'canva', 'nggak', 'tapi', 'data', 'bocor', 'dari', 'situ']","['make', 'canva', 'nggak', 'data', 'bocor', 'situ']",make canva nggak data bocor situ
"b'@hidup_cuma itu biasanya data nomornya bocor kak, aku dulu sering gitu sekarang dah ganti'", itu biasanya data nomornya bocor kak aku dulu sering gitu sekarang dah ganti, itu biasanya data nomornya bocor kak aku dulu sering gitu sekarang dah ganti,"['itu', 'biasanya', 'data', 'nomornya', 'bocor', 'kak', 'aku', 'dulu', 'sering', 'gitu', 'sekarang', 'dah', 'ganti']","['data', 'nomornya', 'bocor', 'kak', 'gitu', 'dah', 'ganti']",data nomor bocor kak gitu dah ganti
"b""Kamu gak perlu khawatir data akan 'bocor', karena kerahasiaan dan keamanan informasi kamu adalah prioritas kami. Semua informasi yang kamu berikan tidak akan dibuka tanpa persetujuanmu. Kerahasiaan informasi kamu dijamin oleh undang-undang.\nYuk, #BeraniKepoSekarang https://t.co/CMqrwxWxCd""",Kamu gak perlu khawatir data akan bocor karena kerahasiaan dan keamanan informasi kamu adalah prioritas kami Semua informasi yang kamu berikan tidak akan dibuka tanpa persetujuanmu Kerahasiaan informasi kamu dijamin oleh undangundangnYuk ,kamu gak perlu khawatir data akan bocor karena kerahasiaan dan keamanan informasi kamu adalah prioritas kami semua informasi yang kamu berikan tidak akan dibuka tanpa persetujuanmu kerahasiaan informasi kamu dijamin oleh undangundangnyuk ,"['kamu', 'gak', 'perlu', 'khawatir', 'data', 'akan', 'bocor', 'karena', 'kerahasiaan', 'dan', 'keamanan', 'informasi', 'kamu', 'adalah', 'prioritas', 'kami', 'semua', 'informasi', 'yang', 'kamu', 'berikan', 'tidak', 'akan', 'dibuka', 'tanpa', 'persetujuanmu', 'kerahasiaan', 'informasi', 'kamu', 'dijamin', 'oleh', 'undangundangnyuk']","['gak', 'khawatir', 'data', 'bocor', 'kerahasiaan', 'keamanan', 'informasi', 'prioritas', 'informasi', 'dibuka', 'persetujuanmu', 'kerahasiaan', 'informasi', 'dijamin', 'undangundangnyuk']",gak khawatir data bocor rahasia aman informasi prioritas informasi buka tuju rahasia informasi jamin undangundangnyuk
