text,clean,casefolding,tokenize,stopwords,stemming
b'Data Polri Dilaporkan Bocor #Nasional https://t.co/06j5EU1lr8',Data Polri Dilaporkan Bocor ,data polri dilaporkan bocor ,"['data', 'polri', 'dilaporkan', 'bocor']","['data', 'polri', 'dilaporkan', 'bocor']",data polri lapor bocor
b'https://t.co/3WR7gNpBug',,,[],[],
"b'Peretas asal Brasil mengklaim telah membobol data personil Polri. Bukan hanya ribuan data pribadi, daftar pelanggaran yang dilakukan anggota Polri juga ikut bocor.\n#DataPolri\n#Hacker https://t.co/f4GTNCHQfZ'",Peretas asal Brasil mengklaim telah membobol data personil Polri Bukan hanya ribuan data pribadi daftar pelanggaran yang dilakukan anggota Polri juga ikut bocorn,peretas asal brasil mengklaim telah membobol data personil polri bukan hanya ribuan data pribadi daftar pelanggaran yang dilakukan anggota polri juga ikut bocorn,"['peretas', 'asal', 'brasil', 'mengklaim', 'telah', 'membobol', 'data', 'personil', 'polri', 'bukan', 'hanya', 'ribuan', 'data', 'pribadi', 'daftar', 'pelanggaran', 'yang', 'dilakukan', 'anggota', 'polri', 'juga', 'ikut', 'bocorn']","['peretas', 'brasil', 'mengklaim', 'membobol', 'data', 'personil', 'polri', 'ribuan', 'data', 'pribadi', 'daftar', 'pelanggaran', 'anggota', 'polri', 'bocorn']",retas brasil klaim bobol data personil polri ribu data pribadi daftar langgar anggota polri bocorn
"b'@VIVAcoid Jgn cm data qta dnk yg bocor, awesome!'", Jgn cm data qta dnk yg bocor awesome, jgn cm data qta dnk yg bocor awesome,"['jgn', 'cm', 'data', 'qta', 'dnk', 'yg', 'bocor', 'awesome']","['jgn', 'cm', 'data', 'qta', 'dnk', 'yg', 'bocor', 'awesome']",jgn cm data qta dnk yg bocor awesome
"b'Waduh, Ribuan Data Anggota Polisi Bocor di Internet https://t.co/6l9pqvlut5'",Waduh Ribuan Data Anggota Polisi Bocor di Internet ,waduh ribuan data anggota polisi bocor di internet ,"['waduh', 'ribuan', 'data', 'anggota', 'polisi', 'bocor', 'di', 'internet']","['ribuan', 'data', 'anggota', 'polisi', 'bocor', 'internet']",ribu data anggota polisi bocor internet
b'Data alo dokter bocor ampe segitunya kah? Perasaan ada aja yg telfon. Ga save bgt. Untung ga pake lg',Data alo dokter bocor ampe segitunya kah Perasaan ada aja yg telfon Ga save bgt Untung ga pake lg,data alo dokter bocor ampe segitunya kah perasaan ada aja yg telfon ga save bgt untung ga pake lg,"['data', 'alo', 'dokter', 'bocor', 'ampe', 'segitunya', 'kah', 'perasaan', 'ada', 'aja', 'yg', 'telfon', 'ga', 'save', 'bgt', 'untung', 'ga', 'pake', 'lg']","['data', 'alo', 'dokter', 'bocor', 'ampe', 'segitunya', 'kah', 'perasaan', 'aja', 'yg', 'telfon', 'ga', 'save', 'bgt', 'untung', 'ga', 'pake', 'lg']",data alo dokter bocor ampe segitunya kah asa aja yg telfon ga save bgt untung ga pake lg
b'@txtdrprogramer Wedew data warga negara bocor aja kaga turun tangan tuh', Wedew data warga negara bocor aja kaga turun tangan tuh, wedew data warga negara bocor aja kaga turun tangan tuh,"['wedew', 'data', 'warga', 'negara', 'bocor', 'aja', 'kaga', 'turun', 'tangan', 'tuh']","['wedew', 'data', 'warga', 'negara', 'bocor', 'aja', 'kaga', 'turun', 'tangan', 'tuh']",wedew data warga negara bocor aja kaga turun tangan tuh
"b'Gawat, Ribuan Data Anggota Polisi Bocor di\xc2\xa0Internet!!! https://t.co/Ww3YcefDU9'",Gawat Ribuan Data Anggota Polisi Bocor,gawat ribuan data anggota polisi bocor,"['gawat', 'ribuan', 'data', 'anggota', 'polisi', 'bocor']","['gawat', 'ribuan', 'data', 'anggota', 'polisi', 'bocor']",gawat ribu data anggota polisi bocor
"b'Gawat! Polri Diserang, Data Bocor dan Dibagikan Secara Gratis https://t.co/uxT4xTihny'",Gawat Polri Diserang Data Bocor dan Dibagikan Secara Gratis ,gawat polri diserang data bocor dan dibagikan secara gratis ,"['gawat', 'polri', 'diserang', 'data', 'bocor', 'dan', 'dibagikan', 'secara', 'gratis']","['gawat', 'polri', 'diserang', 'data', 'bocor', 'dibagikan', 'gratis']",gawat polri serang data bocor bagi gratis
"b'gak tau harus seneng apa sedih, data polri yg bocor ternyata ga ada nama bapak &amp; sepupu'",gak tau harus seneng apa sedih data polri yg bocor ternyata ga ada nama bapak amp sepupu,gak tau harus seneng apa sedih data polri yg bocor ternyata ga ada nama bapak amp sepupu,"['gak', 'tau', 'harus', 'seneng', 'apa', 'sedih', 'data', 'polri', 'yg', 'bocor', 'ternyata', 'ga', 'ada', 'nama', 'bapak', 'amp', 'sepupu']","['gak', 'tau', 'seneng', 'sedih', 'data', 'polri', 'yg', 'bocor', 'ga', 'nama', 'amp', 'sepupu']",gak tau neng sedih data polri yg bocor ga nama amp sepupu
"b'Wew ini data polri bocor lagi, dihack lagi nih'",Wew ini data polri bocor lagi dihack lagi nih,wew ini data polri bocor lagi dihack lagi nih,"['wew', 'ini', 'data', 'polri', 'bocor', 'lagi', 'dihack', 'lagi', 'nih']","['wew', 'data', 'polri', 'bocor', 'dihack', 'nih']",wew data polri bocor dihack nih
"b'Hacker Asal Brasil Klaim Berhasil Bobol Database Polri, Ribuan Data Pribadi Personel\xc2\xa0Bocor https://t.co/micJIknlzP'",Hacker Asal Brasil Klaim Berhasil Bobol Database Polri Ribuan Data Pribadi,hacker asal brasil klaim berhasil bobol database polri ribuan data pribadi,"['hacker', 'asal', 'brasil', 'klaim', 'berhasil', 'bobol', 'database', 'polri', 'ribuan', 'data', 'pribadi']","['hacker', 'brasil', 'klaim', 'berhasil', 'bobol', 'database', 'polri', 'ribuan', 'data', 'pribadi']",hacker brasil klaim hasil bobol database polri ribu data pribadi
"b'Wehhhh ada data paypal bocor di salah satu forum, yang bahayanya enggak cuma data paypal doang. Lengkap capture login yang lainnya juga. \xf0\x9f\x98\x9f'",Wehhhh ada data paypal bocor di salah satu forum yang bahayanya enggak cuma data paypal doang Lengkap capture login yang lainnya juga ,wehhhh ada data paypal bocor di salah satu forum yang bahayanya enggak cuma data paypal doang lengkap capture login yang lainnya juga ,"['wehhhh', 'ada', 'data', 'paypal', 'bocor', 'di', 'salah', 'satu', 'forum', 'yang', 'bahayanya', 'enggak', 'cuma', 'data', 'paypal', 'doang', 'lengkap', 'capture', 'login', 'yang', 'lainnya', 'juga']","['wehhhh', 'data', 'paypal', 'bocor', 'salah', 'forum', 'bahayanya', 'data', 'paypal', 'doang', 'lengkap', 'capture', 'login']",wehhhh data paypal bocor salah forum bahaya data paypal doang lengkap capture login
"b'Data Pribadi Anggota Polri Bocor ke Twitter, Diduga Kena Hack https://t.co/xh02yCCOT6'",Data Pribadi Anggota Polri Bocor ke Twitter Diduga Kena Hack ,data pribadi anggota polri bocor ke twitter diduga kena hack ,"['data', 'pribadi', 'anggota', 'polri', 'bocor', 'ke', 'twitter', 'diduga', 'kena', 'hack']","['data', 'pribadi', 'anggota', 'polri', 'bocor', 'twitter', 'diduga', 'kena', 'hack']",data pribadi anggota polri bocor twitter duga kena hack
"b'3 Server Polri Dibobol Hacker Asal Brasil, Data Anggota Polri Bocor https://t.co/SVbEVwvs98 https://t.co/4NI0sPDuBa'", Server Polri Dibobol Hacker Asal Brasil Data Anggota Polri Bocor, server polri dibobol hacker asal brasil data anggota polri bocor,"['server', 'polri', 'dibobol', 'hacker', 'asal', 'brasil', 'data', 'anggota', 'polri', 'bocor']","['server', 'polri', 'dibobol', 'hacker', 'brasil', 'data', 'anggota', 'polri', 'bocor']",server polri bobol hacker brasil data anggota polri bocor
"b'Ya biasa saja sih, keamanan siber buatan manusia wajar bisa bocor... Data keamanan CIA dan FBI saja bisa bocor, apalagi Polri...Justru yg kaget itu, biasanya gak tau apa2 soal siber, alias kudet...\xf0\x9f\x98\x82 @son1x666 https://t.co/GYJF9ot78a'",Ya biasa saja sih keamanan siber buatan manusia wajar bisa bocor Data keamanan CIA dan FBI saja bisa bocor apalagi PolriJustru yg kaget itu biasanya gak tausoal siber alias ,ya biasa saja sih keamanan siber buatan manusia wajar bisa bocor data keamanan cia dan fbi saja bisa bocor apalagi polrijustru yg kaget itu biasanya gak tausoal siber alias ,"['ya', 'biasa', 'saja', 'sih', 'keamanan', 'siber', 'buatan', 'manusia', 'wajar', 'bisa', 'bocor', 'data', 'keamanan', 'cia', 'dan', 'fbi', 'saja', 'bisa', 'bocor', 'apalagi', 'polrijustru', 'yg', 'kaget', 'itu', 'biasanya', 'gak', 'tausoal', 'siber', 'alias']","['ya', 'sih', 'keamanan', 'siber', 'buatan', 'manusia', 'wajar', 'bocor', 'data', 'keamanan', 'cia', 'fbi', 'bocor', 'polrijustru', 'yg', 'kaget', 'gak', 'tausoal', 'siber', 'alias']",ya sih aman siber buat manusia wajar bocor data aman cia fbi bocor polrijustru yg kaget gak tausoal siber alias
"b'Tapi aku ga pernah spill identitas pribadi orang yg ga aku suka. Itu bikin masalah baru. Ga sopan. Se-gak-sukanya sama orang ga gitu caranya. Itu merusak privasi orang, bahaya bgt data pribadi sampe bocor ke publik. Tolong jangan diulang lagi \xf0\x9f\xa4\xa6\xe2\x80\x8d\xe2\x99\x80\xef\xb8\x8f'",Tapi aku ga pernah spill identitas pribadi orang yg ga aku suka Itu bikin masalah baru Ga sopan Segaksukanya sama orang ga gitu caranya Itu merusak privasi orang bahaya bgt data pribadi sampe bocor ke publik Tolong jangan diulang lagi ,tapi aku ga pernah spill identitas pribadi orang yg ga aku suka itu bikin masalah baru ga sopan segaksukanya sama orang ga gitu caranya itu merusak privasi orang bahaya bgt data pribadi sampe bocor ke publik tolong jangan diulang lagi ,"['tapi', 'aku', 'ga', 'pernah', 'spill', 'identitas', 'pribadi', 'orang', 'yg', 'ga', 'aku', 'suka', 'itu', 'bikin', 'masalah', 'baru', 'ga', 'sopan', 'segaksukanya', 'sama', 'orang', 'ga', 'gitu', 'caranya', 'itu', 'merusak', 'privasi', 'orang', 'bahaya', 'bgt', 'data', 'pribadi', 'sampe', 'bocor', 'ke', 'publik', 'tolong', 'jangan', 'diulang', 'lagi']","['ga', 'spill', 'identitas', 'pribadi', 'orang', 'yg', 'ga', 'suka', 'bikin', 'ga', 'sopan', 'segaksukanya', 'orang', 'ga', 'gitu', 'merusak', 'privasi', 'orang', 'bahaya', 'bgt', 'data', 'pribadi', 'sampe', 'bocor', 'publik', 'tolong', 'diulang']",ga spill identitas pribadi orang yg ga suka bikin ga sopan segaksukanya orang ga gitu rusak privasi orang bahaya bgt data pribadi sampe bocor publik tolong ulang
"b'3 Server Database Polri Jebol Diretas, Semua Data Polisi Berkasus Bocor Termasuk 3\xc2\xa0Jenderal https://t.co/Kq2GPBgO3G'", Server Database Polri Jebol Diretas Semua Data Polisi Berkasus Bocor Termasuk, server database polri jebol diretas semua data polisi berkasus bocor termasuk,"['server', 'database', 'polri', 'jebol', 'diretas', 'semua', 'data', 'polisi', 'berkasus', 'bocor', 'termasuk']","['server', 'database', 'polri', 'jebol', 'diretas', 'data', 'polisi', 'berkasus', 'bocor']",server database polri jebol retas data polisi kasus bocor
b'CISSReC: Ribuan Data Polri Bocor dan Dibagikan Gratis https://t.co/eYr9JGGiK4',CISSReC Ribuan Data Polri Bocor dan Dibagikan Gratis ,cissrec ribuan data polri bocor dan dibagikan gratis ,"['cissrec', 'ribuan', 'data', 'polri', 'bocor', 'dan', 'dibagikan', 'gratis']","['cissrec', 'ribuan', 'data', 'polri', 'bocor', 'dibagikan', 'gratis']",cissrec ribu data polri bocor bagi gratis
"b'Heboh Database Polri Kena Hack, Semua Data Pribadi Polisi Berkasus Bocor, Ada 3 Jenderal\nhttps://t.co/jmxz8O0OwG https://t.co/YZvT35K4pe'",Heboh Database Polri Kena Hack Semua Data Pribadi Polisi Berkasus Bocor AdaJenderaln ,heboh database polri kena hack semua data pribadi polisi berkasus bocor adajenderaln ,"['heboh', 'database', 'polri', 'kena', 'hack', 'semua', 'data', 'pribadi', 'polisi', 'berkasus', 'bocor', 'adajenderaln']","['heboh', 'database', 'polri', 'kena', 'hack', 'data', 'pribadi', 'polisi', 'berkasus', 'bocor', 'adajenderaln']",heboh database polri kena hack data pribadi polisi kasus bocor adajenderaln
b'Ribuan Data Personel Polri Bocor di Internet https://t.co/Hzxh1wfE87',Ribuan Data Personel Polri Bocor di Internet ,ribuan data personel polri bocor di internet ,"['ribuan', 'data', 'personel', 'polri', 'bocor', 'di', 'internet']","['ribuan', 'data', 'personel', 'polri', 'bocor', 'internet']",ribu data personel polri bocor internet
"b'@dawsmuhammad Nah kalo gue td sempet casenya gitu uss. Cuma ketika d cek untuk tagihan bulan depan, itu tiba-tiba udah normal lagi (balik k kisaran 170-200ribuan) \nMknya gw agak debat soal itu tadi, kalo emang bocor kenapa data bulan depannya ga konsisten (bisa tiba-tiba normal tana perbaikan)'", Nah kalo gue td sempet casenya gitu uss Cuma ketika d cek untuk tagihan bulan depan itu tibatiba udah normal lagi balik k kisarannMknya gw agak debat soal itu tadi kalo emang bocor kenapa data bulan depannya ga konsisten bisa tibatiba normal tana perbaikan, nah kalo gue td sempet casenya gitu uss cuma ketika d cek untuk tagihan bulan depan itu tibatiba udah normal lagi balik k kisarannmknya gw agak debat soal itu tadi kalo emang bocor kenapa data bulan depannya ga konsisten bisa tibatiba normal tana perbaikan,"['nah', 'kalo', 'gue', 'td', 'sempet', 'casenya', 'gitu', 'uss', 'cuma', 'ketika', 'd', 'cek', 'untuk', 'tagihan', 'bulan', 'depan', 'itu', 'tibatiba', 'udah', 'normal', 'lagi', 'balik', 'k', 'kisarannmknya', 'gw', 'agak', 'debat', 'soal', 'itu', 'tadi', 'kalo', 'emang', 'bocor', 'kenapa', 'data', 'bulan', 'depannya', 'ga', 'konsisten', 'bisa', 'tibatiba', 'normal', 'tana', 'perbaikan']","['kalo', 'gue', 'td', 'sempet', 'casenya', 'gitu', 'uss', 'd', 'cek', 'tagihan', 'tibatiba', 'udah', 'normal', 'k', 'kisarannmknya', 'gw', 'debat', 'kalo', 'emang', 'bocor', 'data', 'depannya', 'ga', 'konsisten', 'tibatiba', 'normal', 'tana', 'perbaikan']",kalo gue td sempet casenya gitu uss d cek tagih tibatiba udah normal k kisarannmknya gw debat kalo emang bocor data depan ga konsisten tibatiba normal tana baik
"b'POLRI Ketiwasan, Ribuan Data Pribadi dan Data Pelanggaran Personilnya Bocor ke RaidForum https://t.co/XK9x7n7I0O'",POLRI Ketiwasan Ribuan Data Pribadi dan Data Pelanggaran Personilnya Bocor ke RaidForum ,polri ketiwasan ribuan data pribadi dan data pelanggaran personilnya bocor ke raidforum ,"['polri', 'ketiwasan', 'ribuan', 'data', 'pribadi', 'dan', 'data', 'pelanggaran', 'personilnya', 'bocor', 'ke', 'raidforum']","['polri', 'ketiwasan', 'ribuan', 'data', 'pribadi', 'data', 'pelanggaran', 'personilnya', 'bocor', 'raidforum']",polri ketiwasan ribu data pribadi data langgar personilnya bocor raidforum
"b'Database Polri Kena Hack,\nSemua Data Polisi Berkasus Bocor, Ada 3 nama Jenderal didalamnya\nhttps://t.co/DP0iXfzEJr\n\nHhhhmmm..... Kok bisa ya ?! \xf0\x9f\x99\x84\xf0\x9f\xa4\x94'",Database Polri Kena HacknSemua Data Polisi Berkasus Bocor Adanama Jenderal didalamnyan Kok bisa ya,database polri kena hacknsemua data polisi berkasus bocor adanama jenderal didalamnyan kok bisa ya,"['database', 'polri', 'kena', 'hacknsemua', 'data', 'polisi', 'berkasus', 'bocor', 'adanama', 'jenderal', 'didalamnyan', 'kok', 'bisa', 'ya']","['database', 'polri', 'kena', 'hacknsemua', 'data', 'polisi', 'berkasus', 'bocor', 'adanama', 'jenderal', 'didalamnyan', 'ya']",database polri kena hacknsemua data polisi kasus bocor adanama jenderal didalamnyan ya
b'CISSReC: Ribuan Data Polri Bocor dan Dibagikan Secara Gratis\nhttps://t.co/SAsvBUHNNI',CISSReC Ribuan Data Polri Bocor dan Dibagikan Secara Gratisn,cissrec ribuan data polri bocor dan dibagikan secara gratisn,"['cissrec', 'ribuan', 'data', 'polri', 'bocor', 'dan', 'dibagikan', 'secara', 'gratisn']","['cissrec', 'ribuan', 'data', 'polri', 'bocor', 'dibagikan', 'gratisn']",cissrec ribu data polri bocor bagi gratisn
"b'Situs data server Polri diretas, ribuan data anggota bocor dan dibagikan secara gratis.\n\nhttps://t.co/Gvo1BCbECV'",Situs data server Polri diretas ribuan data anggota bocor dan dibagikan secara gratisnn,situs data server polri diretas ribuan data anggota bocor dan dibagikan secara gratisnn,"['situs', 'data', 'server', 'polri', 'diretas', 'ribuan', 'data', 'anggota', 'bocor', 'dan', 'dibagikan', 'secara', 'gratisnn']","['situs', 'data', 'server', 'polri', 'diretas', 'ribuan', 'data', 'anggota', 'bocor', 'dibagikan', 'gratisnn']",situs data server polri retas ribu data anggota bocor bagi gratisnn
b'Ribuan Data Polri Bocor dan Dibagikan Secara Gratis https://t.co/geW25eqiHs',Ribuan Data Polri Bocor dan Dibagikan Secara Gratis ,ribuan data polri bocor dan dibagikan secara gratis ,"['ribuan', 'data', 'polri', 'bocor', 'dan', 'dibagikan', 'secara', 'gratis']","['ribuan', 'data', 'polri', 'bocor', 'dibagikan', 'gratis']",ribu data polri bocor bagi gratis
"b'https://t.co/pvN6JCKpJ0\n\nWow, UU PDP mutlak segera disahkan gini mah'", UU PDP mutlak segera disahkan gini mah, uu pdp mutlak segera disahkan gini mah,"['uu', 'pdp', 'mutlak', 'segera', 'disahkan', 'gini', 'mah']","['uu', 'pdp', 'mutlak', 'disahkan', 'gini', 'mah']",uu pdp mutlak sah gin mah
b'File tersebut berisi banyak informasi penting dari data pribadi personel kepolisian. https://t.co/4WsCLPFjkX',File tersebut berisi banyak informasi penting dari data pribadi personel kepolisian ,file tersebut berisi banyak informasi penting dari data pribadi personel kepolisian ,"['file', 'tersebut', 'berisi', 'banyak', 'informasi', 'penting', 'dari', 'data', 'pribadi', 'personel', 'kepolisian']","['file', 'berisi', 'informasi', 'data', 'pribadi', 'personel', 'kepolisian']",file isi informasi data pribadi personel polisi
b'dan terjadi lg. \nx ini data diumbar kyo ning pasar bedah \xf0\x9f\xa4\xa6\xf0\x9f\x8f\xbb\xe2\x80\x8d\xe2\x99\x82\xef\xb8\x8f\n\nhttps://t.co/Qf2iT9AvZX',dan terjadi lg nx ini data diumbar kyo ning pasar bedah ,dan terjadi lg nx ini data diumbar kyo ning pasar bedah ,"['dan', 'terjadi', 'lg', 'nx', 'ini', 'data', 'diumbar', 'kyo', 'ning', 'pasar', 'bedah']","['lg', 'nx', 'data', 'diumbar', 'kyo', 'ning', 'pasar', 'bedah']",lg nx data umbar kyo ning pasar bedah
b'CISSReC Sebut Ribuan Data Polri Bocor dan Dibagikan Secara Gratis https://t.co/ntWZAqLchj',CISSReC Sebut Ribuan Data Polri Bocor dan Dibagikan Secara Gratis ,cissrec sebut ribuan data polri bocor dan dibagikan secara gratis ,"['cissrec', 'sebut', 'ribuan', 'data', 'polri', 'bocor', 'dan', 'dibagikan', 'secara', 'gratis']","['cissrec', 'ribuan', 'data', 'polri', 'bocor', 'dibagikan', 'gratis']",cissrec ribu data polri bocor bagi gratis
"b'Kebocoran data pribadi kembali terjadi, nahasnya kali ini menimpa kepolisian. Diduga ribuan data anggota polisi bocor dan dibagikan secara gratis di internet. https://t.co/BULJiQTcLu'",Kebocoran data pribadi kembali terjadi nahasnya kali ini menimpa kepolisian Diduga ribuan data anggota polisi bocor dan dibagikan secara gratis di internet ,kebocoran data pribadi kembali terjadi nahasnya kali ini menimpa kepolisian diduga ribuan data anggota polisi bocor dan dibagikan secara gratis di internet ,"['kebocoran', 'data', 'pribadi', 'kembali', 'terjadi', 'nahasnya', 'kali', 'ini', 'menimpa', 'kepolisian', 'diduga', 'ribuan', 'data', 'anggota', 'polisi', 'bocor', 'dan', 'dibagikan', 'secara', 'gratis', 'di', 'internet']","['kebocoran', 'data', 'pribadi', 'nahasnya', 'kali', 'menimpa', 'kepolisian', 'diduga', 'ribuan', 'data', 'anggota', 'polisi', 'bocor', 'dibagikan', 'gratis', 'internet']",bocor data pribadi nahas kali timpa polisi duga ribu data anggota polisi bocor bagi gratis internet
"b'@Spumino_ @yourmedicine27 @unclwn @yunaituq @txtdrberseragam websitenya aman, tapi datanya bocor dan dicuri sama si hackernya. isinya data pribadi sama jenis pelanggaran yang pernah dilakukan'", websitenya aman tapi datanya bocor dan dicuri sama si hackernya isinya data pribadi sama jenis pelanggaran yang pernah dilakukan, websitenya aman tapi datanya bocor dan dicuri sama si hackernya isinya data pribadi sama jenis pelanggaran yang pernah dilakukan,"['websitenya', 'aman', 'tapi', 'datanya', 'bocor', 'dan', 'dicuri', 'sama', 'si', 'hackernya', 'isinya', 'data', 'pribadi', 'sama', 'jenis', 'pelanggaran', 'yang', 'pernah', 'dilakukan']","['websitenya', 'aman', 'datanya', 'bocor', 'dicuri', 'si', 'hackernya', 'isinya', 'data', 'pribadi', 'jenis', 'pelanggaran']",websitenya aman data bocor curi si hackernya isi data pribadi jenis langgar
"b'Pancasila..puya polisi namun data polisi yg bocor dari oknum jendral dan kapten, brigaadil bermasalah ahirnya tercium juga .keburukan kebusukan walau di bukus rapih tetap tercium bau .. https://t.co/18pdcOxLD0'",Pancasilapuya polisi namun data polisi yg bocor dari oknum jendral dan kapten brigaadil bermasalah ahirnya tercium juga keburukan kebusukan walau di bukus rapih tetap tercium bau,pancasilapuya polisi namun data polisi yg bocor dari oknum jendral dan kapten brigaadil bermasalah ahirnya tercium juga keburukan kebusukan walau di bukus rapih tetap tercium bau,"['pancasilapuya', 'polisi', 'namun', 'data', 'polisi', 'yg', 'bocor', 'dari', 'oknum', 'jendral', 'dan', 'kapten', 'brigaadil', 'bermasalah', 'ahirnya', 'tercium', 'juga', 'keburukan', 'kebusukan', 'walau', 'di', 'bukus', 'rapih', 'tetap', 'tercium', 'bau']","['pancasilapuya', 'polisi', 'data', 'polisi', 'yg', 'bocor', 'oknum', 'jendral', 'kapten', 'brigaadil', 'bermasalah', 'ahirnya', 'tercium', 'keburukan', 'kebusukan', 'bukus', 'rapih', 'tercium', 'bau']",pancasilapuya polisi data polisi yg bocor oknum jendral kapten brigaadil masalah ahirnya cium keburu busuk bukus rapih cium bau
b'Sebanyak 28 Ribu Lebih Data Personel Polri Bocor dan Bebas Diperjualbelikan\n\n#inilahcom #inilahdotcom\nhttps://t.co/NiztoEJq7e',SebanyakRibu Lebih Data Personel Polri Bocor dan Bebas Diperjualbelikannn ,sebanyakribu lebih data personel polri bocor dan bebas diperjualbelikannn ,"['sebanyakribu', 'lebih', 'data', 'personel', 'polri', 'bocor', 'dan', 'bebas', 'diperjualbelikannn']","['sebanyakribu', 'data', 'personel', 'polri', 'bocor', 'bebas', 'diperjualbelikannn']",sebanyakribu data personel polri bocor bebas diperjualbelikannn
b'Duh! Data Kepolisian RI Dilaporkan Bocor https://t.co/JFcWRBGrxt',Duh Data Kepolisian RI Dilaporkan Bocor ,duh data kepolisian ri dilaporkan bocor ,"['duh', 'data', 'kepolisian', 'ri', 'dilaporkan', 'bocor']","['duh', 'data', 'kepolisian', 'ri', 'dilaporkan', 'bocor']",duh data polisi ri lapor bocor
b'Ada dua database Polri yang diboborkan hacker. Apa saja isinya?\nhttps://t.co/2GoLjv0KzH',Ada dua database Polri yang diboborkan hacker Apa saja isinyan,ada dua database polri yang diboborkan hacker apa saja isinyan,"['ada', 'dua', 'database', 'polri', 'yang', 'diboborkan', 'hacker', 'apa', 'saja', 'isinyan']","['database', 'polri', 'diboborkan', 'hacker', 'isinyan']",database polri diboborkan hacker isinyan
"b'Kebocoran data pribadi kembali terjadi, nahasnya kali ini menimpa kepolisian. Diduga ribuan data anggota polisi bocor dan dibagikan secara gratis di internet. https://t.co/MzmmQgVhkc'",Kebocoran data pribadi kembali terjadi nahasnya kali ini menimpa kepolisian Diduga ribuan data anggota polisi bocor dan dibagikan secara gratis di internet ,kebocoran data pribadi kembali terjadi nahasnya kali ini menimpa kepolisian diduga ribuan data anggota polisi bocor dan dibagikan secara gratis di internet ,"['kebocoran', 'data', 'pribadi', 'kembali', 'terjadi', 'nahasnya', 'kali', 'ini', 'menimpa', 'kepolisian', 'diduga', 'ribuan', 'data', 'anggota', 'polisi', 'bocor', 'dan', 'dibagikan', 'secara', 'gratis', 'di', 'internet']","['kebocoran', 'data', 'pribadi', 'nahasnya', 'kali', 'menimpa', 'kepolisian', 'diduga', 'ribuan', 'data', 'anggota', 'polisi', 'bocor', 'dibagikan', 'gratis', 'internet']",bocor data pribadi nahas kali timpa polisi duga ribu data anggota polisi bocor bagi gratis internet
b'Duh! Ribuan Data Personil Polri Bocor dan Dibagikan Secara\xc2\xa0Gratis? https://t.co/crdVQBknKv',Duh Ribuan Data Personil Polri Bocor dan Dibagikan,duh ribuan data personil polri bocor dan dibagikan,"['duh', 'ribuan', 'data', 'personil', 'polri', 'bocor', 'dan', 'dibagikan']","['duh', 'ribuan', 'data', 'personil', 'polri', 'bocor', 'dibagikan']",duh ribu data personil polri bocor bagi
"b'Kebocoran data pribadi kembali terjadi, nahasnya kali ini menimpa kepolisian. Diduga ribuan data anggota polisi bocor dan dibagikan secara gratis di internet. https://t.co/zJvzBu7jfa'",Kebocoran data pribadi kembali terjadi nahasnya kali ini menimpa kepolisian Diduga ribuan data anggota polisi bocor dan dibagikan secara gratis di internet ,kebocoran data pribadi kembali terjadi nahasnya kali ini menimpa kepolisian diduga ribuan data anggota polisi bocor dan dibagikan secara gratis di internet ,"['kebocoran', 'data', 'pribadi', 'kembali', 'terjadi', 'nahasnya', 'kali', 'ini', 'menimpa', 'kepolisian', 'diduga', 'ribuan', 'data', 'anggota', 'polisi', 'bocor', 'dan', 'dibagikan', 'secara', 'gratis', 'di', 'internet']","['kebocoran', 'data', 'pribadi', 'nahasnya', 'kali', 'menimpa', 'kepolisian', 'diduga', 'ribuan', 'data', 'anggota', 'polisi', 'bocor', 'dibagikan', 'gratis', 'internet']",bocor data pribadi nahas kali timpa polisi duga ribu data anggota polisi bocor bagi gratis internet
"b'@democrazymedia sering banget data pemerintah bocor, udah kayak open source aja'", sering banget data pemerintah bocor udah kayak open source aja, sering banget data pemerintah bocor udah kayak open source aja,"['sering', 'banget', 'data', 'pemerintah', 'bocor', 'udah', 'kayak', 'open', 'source', 'aja']","['banget', 'data', 'pemerintah', 'bocor', 'udah', 'kayak', 'open', 'source', 'aja']",banget data perintah bocor udah kayak open source aja
"b'Waduh, Ribuan Data Anggota Polisi Bocor di Internet https://t.co/5zR4mWRDBb'",Waduh Ribuan Data Anggota Polisi Bocor di Internet ,waduh ribuan data anggota polisi bocor di internet ,"['waduh', 'ribuan', 'data', 'anggota', 'polisi', 'bocor', 'di', 'internet']","['ribuan', 'data', 'anggota', 'polisi', 'bocor', 'internet']",ribu data anggota polisi bocor internet
